{
  "$schema": "../../schemas/v2/solution.schema.json",
  "schemaVersion": 2,
  "kind": "solution",
  "id": "SOLUTION-FIN-001",
  "title": "행사 구매 요청 제출 목표 동작 설계",
  "revision": 1,
  "status": "approved",
  "supersedes": null,
  "changeSummary": "FLOW-FIN-001@R2의 구매 요청 제출 흐름을 실현하는 시스템 책임, 서버 개인 초안, 검증·격리·복구 방향을 승인한 최초 목표 설계",
  "approval": {
    "approvedBy": "제품 책임자",
    "approvedAt": "2026-08-03T16:49:37+09:00"
  },
  "sourceEvidence": [
    {
      "id": "SRC-001",
      "title": "현재 API 애플리케이션 진입점",
      "kind": "repository_file",
      "authority": "other_reference",
      "approvalState": "current",
      "conflictsWith": [],
      "locator": {
        "kind": "repository_path",
        "value": "apps/api/src/vada_api/main.py"
      },
      "observedAt": "2026-08-03T16:20:56+09:00",
      "sourceVersion": {
        "kind": "content_digest",
        "value": "sha256:A1B4791AADBA2D6CD7894DA3685882FD2CC8F513DBFE3716A3F414249E85A34D"
      },
      "note": "헬스체크 외 재정 도메인 구현이 없어 신규 목표 동작 설계가 필요합니다."
    },
    {
      "id": "SRC-002",
      "title": "현재 제품 웹 진입 화면",
      "kind": "repository_file",
      "authority": "other_reference",
      "approvalState": "current",
      "conflictsWith": [],
      "locator": {
        "kind": "repository_path",
        "value": "apps/web/src/App.tsx"
      },
      "observedAt": "2026-08-03T16:20:56+09:00",
      "sourceVersion": {
        "kind": "content_digest",
        "value": "sha256:62338C59CC9EF09796AB18A5568242661A74C75930B7BF53EAA653F4EC0A6157"
      },
      "note": "제품 웹은 시작용 화면이며 구매 요청 사용자 흐름이 구현되어 있지 않습니다."
    },
    {
      "id": "SRC-003",
      "title": "VADA 저장소 실행·보안 지침",
      "kind": "repository_file",
      "authority": "other_reference",
      "approvalState": "current",
      "conflictsWith": [],
      "locator": {
        "kind": "repository_path",
        "value": "AGENTS.md"
      },
      "observedAt": "2026-08-03T16:20:56+09:00",
      "sourceVersion": {
        "kind": "content_digest",
        "value": "sha256:AFDE6F2AFC81BD7A68C3FBC8F6764A46CB5F6E3190CB36AA795E988214608C6A"
      },
      "note": "서버 권한 판정, 조직 격리, UTC 저장, 한국어 IME와 검증 의무를 설계 제약으로 사용합니다."
    },
    {
      "id": "SRC-004",
      "title": "Web Content Accessibility Guidelines 2.2",
      "kind": "external_document",
      "authority": "other_reference",
      "approvalState": "current",
      "conflictsWith": [],
      "locator": {
        "kind": "uri",
        "value": "https://www.w3.org/TR/WCAG22/"
      },
      "observedAt": "2026-08-03T16:20:56+09:00",
      "sourceVersion": {
        "kind": "document_revision",
        "value": "W3C Recommendation 12 December 2024"
      },
      "note": "입력 오류 식별·수정 기회와 상태 메시지의 프로그램적 전달을 목표 상호작용에 적용합니다."
    },
    {
      "id": "SRC-005",
      "title": "OWASP HTML5 Security Cheat Sheet",
      "kind": "external_document",
      "authority": "other_reference",
      "approvalState": "current",
      "conflictsWith": [],
      "locator": {
        "kind": "uri",
        "value": "https://cheatsheetseries.owasp.org/cheatsheets/HTML5_Security_Cheat_Sheet.html"
      },
      "observedAt": "2026-08-03T16:38:57+09:00",
      "sourceVersion": null,
      "note": "인증·권한을 전제로 하는 민감 정보를 localStorage에 보관하지 말고 브라우저 저장값을 신뢰하지 말라는 보안 근거로 사용합니다."
    },
    {
      "id": "SRC-006",
      "title": "MDN Storage quotas and eviction criteria",
      "kind": "external_document",
      "authority": "other_reference",
      "approvalState": "current",
      "conflictsWith": [],
      "locator": {
        "kind": "uri",
        "value": "https://developer.mozilla.org/en-US/docs/Web/API/Storage_API/Storage_quotas_and_eviction_criteria"
      },
      "observedAt": "2026-08-03T16:38:57+09:00",
      "sourceVersion": null,
      "note": "브라우저 저장은 기본적으로 최선형 보존이며 사용자 삭제·저장 공간 상황에 따라 제거될 수 있다는 신뢰성 근거로 사용합니다."
    },
    {
      "id": "SRC-007",
      "title": "구매 요청 제출 목표 설계에 대한 제품 책임자 전체 승인",
      "kind": "conversation",
      "authority": "direct_decision",
      "approvalState": "approved",
      "conflictsWith": [],
      "locator": {
        "kind": "conversation_ref",
        "value": "current-thread/vada-finance-solution-five-points-approval-2026-08-03"
      },
      "observedAt": "2026-08-03T16:49:37+09:00",
      "sourceVersion": null,
      "note": "서버 권한 판정, 계정별 서버 초안, 제출 시 전체 재검증과 원자적 확정, 실패 시 입력 보존, 조직 격리·중복 방지·민감 정보 저장 최소화의 다섯 방향을 모두 승인했습니다."
    }
  ],
  "domainRef": {
    "id": "DOMAIN-FIN",
    "revision": 1
  },
  "flowRef": {
    "id": "FLOW-FIN-001",
    "revision": 2
  },
  "implementationContext": {
    "mode": "greenfield",
    "rationale": "현재 제품 코드에는 재정 기능이 없고 기존 와이어프레임은 제품 의미의 입력 근거일 뿐 구현 구조의 재사용 기준선이 아닙니다. 승인된 도메인 R1과 플로우 R2에서 새 목표 동작을 설계합니다.",
    "sourceRefs": [
      "SRC-001",
      "SRC-002",
      "SRC-003"
    ]
  },
  "designAreas": [
    {
      "area": "interaction",
      "status": "covered",
      "elementRefs": [
        "DESIGN-INTERACTION-001",
        "DESIGN-INTERACTION-002",
        "DESIGN-INTERACTION-003",
        "DESIGN-INTERACTION-004",
        "DESIGN-INTERACTION-005",
        "DESIGN-INTERACTION-006",
        "DESIGN-STATE-001",
        "DESIGN-STATE-002",
        "DESIGN-STATE-003",
        "DESIGN-STATE-004",
        "DESIGN-STATE-005"
      ],
      "rationale": "작성 진입부터 제출 결과의 재조회까지 정상·권한·입력·예산 분기를 사용자 관점으로 연결합니다."
    },
    {
      "area": "domain",
      "status": "covered",
      "elementRefs": [
        "DESIGN-DOMAIN-001",
        "DESIGN-DOMAIN-002"
      ],
      "rationale": "구매 요청 묶음과 품목 단위, 초안에서 검토 대기로의 의미 전환을 구분합니다."
    },
    {
      "area": "data",
      "status": "covered",
      "elementRefs": [
        "DESIGN-DATA-001",
        "DESIGN-DATA-002",
        "DESIGN-DATA-003",
        "DESIGN-SYSTEM-002",
        "DESIGN-SYSTEM-004"
      ],
      "rationale": "사용자 입력, 서버 파생 정보, 계산값과 영속 결과의 의미를 분리합니다."
    },
    {
      "area": "authorization",
      "status": "covered",
      "elementRefs": [
        "DESIGN-SYSTEM-001",
        "DESIGN-QUALITY-001"
      ],
      "rationale": "UI 노출과 별개로 현재 조직·행사·멤버십 관계를 서버가 판정하도록 설계합니다."
    },
    {
      "area": "interface",
      "status": "covered",
      "elementRefs": [
        "DESIGN-INTERFACE-001",
        "DESIGN-SYSTEM-002",
        "DESIGN-SYSTEM-004"
      ],
      "rationale": "클라이언트와 서버가 교환할 동작 경계를 프로토콜·프레임워크 선택 전에 고정합니다."
    },
    {
      "area": "validation",
      "status": "covered",
      "elementRefs": [
        "DESIGN-STATE-002",
        "DESIGN-STATE-005",
        "DESIGN-SYSTEM-003"
      ],
      "rationale": "입력 실패와 예산 초과를 다른 결과로 처리하고 실패 시 요청이 생성되지 않게 합니다."
    },
    {
      "area": "security_privacy",
      "status": "covered",
      "elementRefs": [
        "DESIGN-QUALITY-001",
        "DESIGN-QUALITY-002",
        "DESIGN-QUALITY-005"
      ],
      "rationale": "조직 격리와 신뢰 경계를 서버에 두고 재정 입력의 불필요한 로그·브라우저 영속 저장을 막습니다."
    },
    {
      "area": "accessibility",
      "status": "covered",
      "elementRefs": [
        "DESIGN-QUALITY-003"
      ],
      "rationale": "입력 오류와 저장·제출 상태를 키보드 및 보조기술 사용자도 식별하도록 합니다."
    },
    {
      "area": "operations",
      "status": "covered",
      "elementRefs": [
        "DESIGN-SYSTEM-003",
        "DESIGN-QUALITY-004"
      ],
      "rationale": "중복 제출 방지, 감사 가능한 상태 전환과 장애 추적 정보를 정의합니다."
    },
    {
      "area": "verification",
      "status": "covered",
      "elementRefs": [
        "DESIGN-VERIFY-001",
        "DESIGN-VERIFY-002",
        "DESIGN-VERIFY-003",
        "DESIGN-VERIFY-004",
        "DESIGN-VERIFY-005",
        "DESIGN-VERIFY-006",
        "DESIGN-VERIFY-007",
        "DESIGN-VERIFY-008"
      ],
      "rationale": "승인된 여덟 완료 시나리오를 각각 독립적으로 증명할 검증 의도를 둡니다."
    }
  ],
  "designElements": [
    {
      "id": "DESIGN-INTERACTION-001",
      "kind": "interaction_step",
      "title": "구매 요청 작성 시작",
      "description": "권한 보유자가 선택된 행사의 재정 맥락에서 새 구매 요청 작성을 시작하며, 시스템은 인증된 요청자·소속 부서·행사를 현재 맥락으로 보여줍니다.",
      "domainItemRefs": [
        "DOMAIN-RULE-PURCHASE-REQUEST-CREATE",
        "DOMAIN-RULE-REQUEST-COMPOSITION"
      ],
      "flowItemRefs": [
        "OUTCOME-001",
        "PRECONDITION-001",
        "PRECONDITION-002",
        "STEP-01"
      ],
      "sourceRefs": []
    },
    {
      "id": "DESIGN-INTERACTION-002",
      "kind": "interaction_step",
      "title": "요청 공통 정보 입력",
      "description": "요청자가 제목·필요일·구매 목적·우선순위를 입력하고 현재 입력값을 유지한 채 품목 작성으로 이어갑니다.",
      "domainItemRefs": [],
      "flowItemRefs": [
        "FLOW-RULE-REQUEST-COMMON-INPUT",
        "STEP-02"
      ],
      "sourceRefs": []
    },
    {
      "id": "DESIGN-INTERACTION-003",
      "kind": "interaction_step",
      "title": "구매 품목 구성",
      "description": "요청자가 하나 이상의 품목을 추가·수정·삭제하고 구매 유형별 정보와 가격 근거를 입력하며 품목별 금액과 총액을 즉시 확인합니다.",
      "domainItemRefs": [
        "DOMAIN-RULE-REQUEST-COMPOSITION",
        "DOMAIN-RULE-ITEM-INDEPENDENCE"
      ],
      "flowItemRefs": [
        "FLOW-RULE-ITEM-COMMON-INPUT",
        "FLOW-RULE-TYPE-SPECIFIC-INPUT",
        "FLOW-RULE-TOTAL-CALCULATION",
        "STEP-03"
      ],
      "sourceRefs": []
    },
    {
      "id": "DESIGN-INTERACTION-004",
      "kind": "interaction_step",
      "title": "작성 초안 보관과 재개",
      "description": "요청자는 제출 전 입력을 자신의 계정에 임시 저장하고 같은 계정의 같은 행사 작성 화면에서 복원하거나 명시적으로 삭제합니다.",
      "domainItemRefs": [],
      "flowItemRefs": [
        "FLOW-RULE-DRAFT-RESUME",
        "FLOW-RULE-DRAFT-SAVE-RESULT",
        "STEP-04"
      ],
      "sourceRefs": []
    },
    {
      "id": "DESIGN-INTERACTION-005",
      "kind": "interaction_step",
      "title": "구매 요청 제출",
      "description": "요청자가 제출을 실행하면 시스템이 전체 요청과 품목을 검증하고 성공한 경우에만 하나의 검토 대기 요청으로 확정합니다.",
      "domainItemRefs": [
        "DOMAIN-RULE-OVER-BUDGET-SUBMISSION"
      ],
      "flowItemRefs": [
        "FLOW-RULE-SUBMISSION-VALIDATION",
        "FLOW-RULE-SUBMISSION-RESULT",
        "STEP-05"
      ],
      "sourceRefs": []
    },
    {
      "id": "DESIGN-INTERACTION-006",
      "kind": "interaction_step",
      "title": "제출 결과 재확인",